{
  "schema_version": 1,
  "phase": "phase-13-z3-csv",
  "titel": "Export z3 CSV-Schicht (GoBD-Datentraegerueberlassung): Eingaben/Zwischengroessen/Ergebnisse als CSV (Semikolon, Dezimalkomma, CRLF) — Schicht 1/3",
  "vorlage": null,
  "funktionen": [
    {
      "name": "export_z3_csv",
      "datei": "R/z3.R",
      "zweck": "Schreibt die EINGABEN, ZWISCHENGRÖSSEN und ERGEBNISSE eines Laufs als CSV-Dateien in ein VERZEICHNIS pfad — Schicht 1/3 des GoBD-Z3-Exports (die index.xml-Beschreibung baut Schicht 2/3 export_z3_index, die Komposition+App Schicht 3/3 export_z3). Reine Funktion, deterministisch (kein Sys.time() im Inhalt, kein RNG, kein Grafikgeraet); ruft KEINE Kernel-Funktion (engine_funktionen leer) — sie nutzt export_bloecke_bauen (R/export.R) fuer die Ergebnis-Bloecke (unantastbarer Bestand, nur aufgerufen, nicht veraendert). SIGNATUR export_z3_csv(ergebnisse, sc, pfad): ergebnisse = BENANNTE Ergebnisobjekt-Liste (gleicher Vertrag wie export_xlsx: forecast, sim_monate, sim_deckung, varianzzerlegung, vergleich — nur die vorhandenen Eintraege); sc = liqui_scenario (liefert die Eingaben: sc$workbook, sc$name, sc$mdl$HMAX/open_cash/kk_zins/kk_limit, sc$sim$paths/seed, sc$assume-Treiber); pfad = Zielverzeichnis (wird rekursiv angelegt, vorhandene Dateien UEBERSCHRIEBEN — write-once liegt auf Run-Ebene im Manifest, nicht hier; der Export ist wiederausfuehrbar). CSV-DATEIEN (UTF-8, Semikolon-Trenner, Dezimalkomma OHNE Tausenderpunkt, CRLF-Zeilenende, KEIN Quoting — Zellwerte sind numerisch oder einfache Bezeichner ohne Semikolon/Anfuehrungszeichen/Zeilenumbruch; Kopfzeile = Spaltennamen): (1) eingaben.csv = Key/Wert-Block (Spalten kennzahl/wert) mit den Eingaben in Vertragsreihenfolge Mappe, Szenario, HMAX, Sim_Pfade, Sim_Seed, Open_Cash, KK_Zins, KK_Limit, Historie_GuV (= forecast$validation$erg_eng, NUR wenn forecast in ergebnisse liegt — der historische GuV-Wert als Kalibrierungs-Eingabeanker) sowie je eine Zeile pro Treiber in sc$assume (kennzahl = Treiber-Name, wert = Treiber-Wert, in sc$assume-Reihenfolge); (2) je Ergebnis-Block aus export_bloecke_bauen EINE CSV gleichen Namens (.csv) — forecast expandiert zu forecast.csv (cash-Matrix, erste Spalte Position + M1..MH) und forecast_kpis.csv (kennzahl/wert, Vertragsreihenfolge trough/trough_month/maxKK/months_below/result/end); sim_monate/sim_deckung/varianzzerlegung/vergleich je eine CSV (derselbe Block-Inhalt wie die xlsx-Blaetter). ZAHLENFORMAT: Dezimalkomma via Punkt-zu-Komma ohne Tausenderpunkt und ohne wissenschaftliche Notation im EUR-Wertebereich — Integrale (-5235600, -5135990, 2672411) bleiben punkt- und kommalos, Dezimalzahlen (kk_zins, Quantilen) tragen genau ein Dezimalkomma. RUECKGABE list(pfad = <das uebergebene Verzeichnis, unveraendert>, dateien = <character der geschriebenen CSV-Dateinamen in Schreibreihenfolge, OHNE 'index.xml' — index.xml ist Schicht 2/3>). FEHLERFAELLE (benannt, Stil wie manifest_validieren in R/manifest.R): ergebnisse keine benannte nicht-leere Liste -> stop (delegiert an export_bloecke_bauen, Fehlertext nennt den Namen); sc ohne Klasse liqui_scenario -> stop; pfad kein nicht-leerer String oder nicht anlegbar -> stop MIT Pfad. KEIN PDF/A (die CSV-Schicht schreibt ausschliesslich .csv). BESTANDSSCHUTZ: beruehrt weder kernel/ NOCH R/export.R NOCH R/manifest.R NOCH eine test_export_*/test_manifest*-Datei (unantastbarer Bestand) — ruft NUR export_bloecke_bauen auf und legt KEIN neues Paket an (digest/jsonlite/openxlsx2 sind seit Phase-9/12 im need-Vektor von tests/deps.R).",
      "engine_funktionen": []
    }
  ],
  "tests": [
    {
      "datei": "tests/test_export_z3_csv.R",
      "art": "testthat",
      "rot_zuerst": true,
      "prueft": "Spezifikation der Z3-CSV-Schicht, rot zuerst (ungeschuetztes source() von R/z3.R am Kopf bricht ab, solange die Datei fehlt bzw. export_z3_csv undefiniert ist; zusaetzlich gesourct: kernel/engine.R, kernel/distributions.R, R/scenario.R, R/phase_forecast.R, R/export.R, tests/tier1_baseline.R; kein skip, kein succeed, keine zweite Monte-Carlo, kleine Laufzeit — phase_forecast ist deterministisch). Das Binding-Orakel ist eine EINGEFRORENE Fixture (Blockprinzip c17d29a: vorlagenfreie Einheit bekommt das Orakel in Runde T) — ein deterministischer phase_forecast-Lauf auf der Tier-1-Mappe. (1) RUECKGABE-VERTRAG — export_z3_csv(list(forecast = fc), scenario_from_workbook(WB), tmpdir) liefert list(pfad, dateien); pfad existiert und identical dem Eingabeverzeichnis; dateien enthaelt 'eingaben.csv', 'forecast.csv', 'forecast_kpis.csv' und KEIN 'index.xml' (Schicht 2/3) und keine .pdf/.pdfa-Datei. (2) CSV-FORMAT — jede CSV: UTF-8, CRLF (jedes \\n von \\r eingeleitet, roh ueber readBin geprueft), Semikolon-Trenner (jede nicht-leere Zeile enthaelt ';'), Dezimalkomma OHNE Tausenderpunkt und OHNE Dezimalpunkt (KEINE Zelle matched [0-9][.][0-9]); Integrale bleiben ohne Punkt und Komma. (3) TIER-1-ROUNDTRIP (Toleranz 0, unabhaengiges Orakel — die eingefrorenen Literale aus tests/tier1_baseline.R, NICHT aus forecast gezogen): forecast_kpis.csv 'trough' -> round == -5135990 und 'result' -> round == 2672411; eingaben.csv 'Historie_GuV' -> round == -5235600; Lesen ueber readLines + Semikolon-Split + Dezimalkomma-zu-Punkt + as.numeric. (4) DEZIMALKOMMA POSITIV — der KK_Zins-Eingabewert (sc$mdl$kk_zins, nicht-ganzzahlig) steht in eingaben.csv mit genau einem ',' (kein '.') und rundet identisch zum Modellwert. (5) DATENTREUE — die forecast_kpis-CSV-Werte (trough, result) sind dieselben wie die xlsx-Ruecklesung (export_xlsx(list(forecast = fc), xlsx_tmp) + openxlsx2::wb_to_df, Blatt forecast_kpis) — eine Quelle export_bloecke_bauen. (6) FEHLERFAELLE — ergebnisse unbenannt/leer (delegiert an export_bloecke_bauen), sc ohne Klasse liqui_scenario, pfad nicht anlegbar -> je benannter Fehler. (7) RNG-WAECHTER — .Random.seed vor/nach export_z3_csv unveraendert (kein RNG im GoBD-Pfad). BESTANDSSCHUTZ: beruehrt weder kernel/ NOCH R/export.R NOCH R/manifest.R NOCH eine test_export_*/test_manifest*-Datei."
    }
  ],
  "anker": {
    "tier1_unveraendert": true,
    "phasen_anker": [
      {
        "kennzahl": "export_z3_csv: CSV-Buendel eingaben.csv + Ergebnis-CSVs (ohne index.xml, ohne PDF); drei Tier-1-Anker ueberleben den Dezimalkomma-CSV-Roundtrip (Toleranz 0); CRLF/Semikolon/Dezimalkomma",
        "kriterium": "export_z3_csv schreibt ein Verzeichnis-Buendel aus eingaben.csv + den Ergebnis-CSVs (forecast, forecast_kpis, ...) OHNE index.xml (Schicht 2/3) und OHNE .pdf/.pdfa. Die drei Tier-1-Anker ueberleben den CSV-Roundtrip (Dezimalkomma zu Punkt, Toleranz 0 via round()==Literal): Tiefpunkt -5135990 und Planergebnis 2672411 in forecast_kpis.csv, Historie -5235600 in eingaben.csv — das Orakel zieht die Literale aus dem Vertrag (tests/tier1_baseline.R), nicht aus forecast. CSV-Format: UTF-8, CRLF-Zeilenende, Semikolon-Trenner, Dezimalkomma ohne Tausenderpunkt und ohne Dezimalpunkt (keine Zelle matched [0-9][.][0-9]); KK_Zins als Dezimalwert traegt ein ','. Toleranz 0 (Roundtrips als round()==Literal, sonst Identitaets-/Existenz-/String-Pruefungen); der Pruefausdruck versorgt sich selbst (Tier-1-Mappe WB, deterministischer phase_forecast-Lauf, frisches tempdir-Buendel) — Kontext: kernel/engine.R, kernel/distributions.R, R/scenario.R, R/phase_forecast.R, R/export.R und R/z3.R gesourct; WB = fixtures-Mappe.",
        "pruefung": "local({ sc <- scenario_from_workbook(WB, name = \"z3csvAnker\"); fc <- phase_forecast(sc); out <- file.path(tempdir(), \"z3-csv-anker\"); unlink(out, recursive = TRUE); r <- tryCatch(export_z3_csv(list(forecast = fc), sc, out), error = function(e) list(pfad = NA, dateien = character(0))); pfade <- if (file.exists(out)) list.files(out, full.names = TRUE) else character(0); bn <- basename(pfade); files_ok <- all(c(\"eingaben.csv\", \"forecast.csv\", \"forecast_kpis.csv\") %in% bn) && !\"index.xml\" %in% bn && !any(grepl(\"[.](pdf|pdfa)$\", bn, ignore.case = TRUE)) && identical(r$pfad, out); kv <- function(path, key) { if (!file.exists(path)) return(NA_character_); for (ln in readLines(path, warn = FALSE)[-1L]) { f <- strsplit(ln, \";\", fixed = TRUE)[[1L]]; if (length(f) >= 2L && identical(f[1L], key)) return(f[2L]) }; NA_character_ }; num <- function(s) as.numeric(sub(\",\", \".\", s, fixed = TRUE)); fkp <- file.path(out, \"forecast_kpis.csv\"); egb <- file.path(out, \"eingaben.csv\"); tier1_ok <- isTRUE(round(num(kv(fkp, \"trough\"))) == -5135990) && isTRUE(round(num(kv(fkp, \"result\"))) == 2672411) && isTRUE(round(num(kv(egb, \"Historie_GuV\"))) == -5235600); kk_zelle <- kv(egb, \"KK_Zins\"); kk <- sc$mdl$kk_zins; kk_positiv <- if (isTRUE(kk != round(kk))) isTRUE(grepl(\",\", kk_zelle, fixed = TRUE)) else TRUE; dezimal_ok <- TRUE; crlf_ok <- TRUE; semi_ok <- TRUE; for (pf in pfade[grepl(\"[.]csv$\", bn, ignore.case = TRUE)]) { rb <- readBin(pf, \"raw\", n = file.info(pf)$size); ch <- rawToChar(rb); if (grepl(\"[0-9][.][0-9]\", ch)) dezimal_ok <- FALSE; nl <- gregexpr(\"\\n\", ch, fixed = TRUE)[[1L]]; if (nl[1L] != -1L && !isTRUE(all(ch[nl - 1L] == \"\\r\"))) crlf_ok <- FALSE; ll <- readLines(pf, warn = FALSE); if (!isTRUE(all(grepl(\";\", ll[nzchar(ll)], fixed = TRUE)))) semi_ok <- FALSE }; unlink(out, recursive = TRUE); isTRUE(files_ok) && isTRUE(tier1_ok) && isTRUE(kk_positiv) && isTRUE(dezimal_ok) && isTRUE(crlf_ok) && isTRUE(semi_ok) })",
        "toleranz": 0,
        "toleranz_bezug": "absolut"
      }
    ]
  },
  "schirm": {
    "menue_wert": null,
    "reiter": [],
    "kennzahlen": []
  }
}
